{
  "navItems": [
    { "id": "dashboard", "title": "Dashboard", "url": "/" },
    { "id": "tasks", "title": "Tasks", "url": "/tasks" },
    { "id": "kanban", "title": "Kanban", "url": "/kanban" },
    { "id": "reports", "title": "Reports", "url": "/reports" }
  ],
  "sidebarLinks": [
    { "label": "Dashboard", "href": "/" },
    { "label": "Tasks", "href": "/tasks" },
    { "label": "Kanban", "href": "/kanban" },
    { "label": "Reports", "href": "/reports" }
  ],
  "adminSidebarLinks": [
    { "label": "Dashboard", "href": "/admin/dashboard", "active": true },
    { "label": "Back to CRM", "href": "/", "active": false }
  ],
  "labels": { "adminSidebarLabel": "Admin" }
}
